{
  "id": "unsloth/glm47-full-gguf",
  "name": "GLM-4.7 355B/32B MoE GGUF Q4_K_M",
  "type": "llm",
  "engine": "openclaw2go-llamacpp",
  "repo": "unsloth/GLM-4.7-GGUF",
  "files": [
    "Q4_K_M/GLM-4.7-Q4_K_M-00001-of-00005.gguf",
    "Q4_K_M/GLM-4.7-Q4_K_M-00002-of-00005.gguf",
    "Q4_K_M/GLM-4.7-Q4_K_M-00003-of-00005.gguf",
    "Q4_K_M/GLM-4.7-Q4_K_M-00004-of-00005.gguf",
    "Q4_K_M/GLM-4.7-Q4_K_M-00005-of-00005.gguf"
  ],
  "downloadDir": "/workspace/models/GLM-4.7-GGUF",
  "servedAs": "glm-4.7",
  "vram": { "model": 130000, "overhead": 2000 },
  "kvCacheMbPer1kTokens": 40,
  "defaults": { "contextLength": 131072, "port": 8000 },
  "startDefaults": { "gpuLayers": "999", "parallel": "1" },
  "extraStartArgs": ["-fa", "on"],
  "provider": { "name": "local-llamacpp", "api": "openai-completions" },
  "default": false,
  "status": "experimental"
}
